id_cliente;ciclo;estandar;detalle_estandar;estandares_minimos;numeral;numerales_del_cliente;siete;veintiun;sesenta;item_del_estandar;evaluacion_inicial;valor;puntaje_cuantitativo;item;criterio;modo_de_verificacion;calificacion;nivel_de_evaluacion;observaciones
68;II. HACER;GESTIÓN DE LA SALUD (20%);Condiciones de salud en el trabajo (9%);21-60 - Restricciones y recomendaciones médico laborales;3.1.6;60;;21;60;3.1.6 Restricciones y recomendaciones médico laborales;;1;;Restricciones y recomendaciones médico laborales;"Cumplir las restricciones y recomendaciones médico laborales realizadas por parte de la Empresa Promotora de Salud (EPS) o Administradora de Riesgos Laborales (ARL) prescritas a los trabajadores para la realización de sus funciones.

Adecuar el puesto de trabajo, reubicar al trabajador o realizar la readaptación laboral cuando se requiera.

Entregar a quienes califican en primera oportunidad y/o a las Juntas de Calificación de Invalidez los documentos que son responsabilidad del empleador conforme a las normas, para la calificación de origen y pérdida de la capacidad laboral.
";"Solicitar documento de recomendaciones y restricciones médico laborales a trabajadores y constatar las evidencias de que la empresa las ha acatado ha realizado las acciones que se requieran en materia de reubicación o readaptación.

Solicitar soporte de recibido por parte de quienes califican en primera oportunidad y/o a las Juntas de Calificación de Invalidez, de los documentos que corresponde remitir al empleador para efectos del proceso de calificación de origen y pérdida de capacidad laboral.
";;;
68;II. HACER;GESTIÓN DE LA SALUD (20%);Registro, reporte e investigación de las enfermedades laborales, los incidentes y accidentes del trabajo (5%);21-60 - Investigación de incidentes, accidentes de trabajo y las enfermedades cuando sean diagnosticadas como laborales;3.2.2;60;;21;60;3.2.2 Investigación de  Incidentes, Accidentes y Enfermedades Laborales;;2;;Investigación de incidentes, accidentes de trabajo y las enfermedades cuando sean diagnosticadas como laborales;Investigar los incidentes, y todos los accidentes de trabajo y las enfermedades cuando sean diagnosticadas como laborales, con la participación del COPASST, determinando las causas básicas e inmediatas y la posibilidad de que se presenten nuevos casos.;"Verificar por medio de un muestreo si se investigan los incidentes, accidentes de trabajo y las enfermedades laborales con la participación del COPASST, y si se definieron acciones para otros trabajadores potencialmente expuestos.

Constatar que las investigaciones se hayan realizado dentro de los quince (15) días siguientes a su ocurrencia a través del equipo investigador y evidenciar que se hayan remitido los informes de las investigaciones de accidente de trabajo grave o mortal o de enfermedad laboral mortal.

En caso de accidente grave o se produzca la muerte, verificar la participación de un profesional con licencia en Seguridad y Salud en el Trabajo en la investigación (propio o contratado), así como del Comité Paritario de SST.
";;;
68;II. HACER;GESTIÓN DE PELIGROS Y RIESGOS (30%);Medidas de prevención y control para intervenir los peligros/riesgos (15%);21-60 - Entrega de los elementos de protección personal – EPP  y capacitación en uso adecuado;4.2.6;60;;21;60;4.2.6 Entrega de Elementos de Protección Persona EPP, se verifica con contratistas y subcontratistas;;2.5;;Entrega de los elementos de protección personal – EPP  y capacitación en uso adecuado;"Suministrar a los trabajadores los elementos de protección personal que se requieran y reponerlos oportunamente, conforme al desgaste y condiciones de uso de los mismos.

Verificar que los contratistas y subcontratistas entregan los elementos de protección personal que se requiera a sus trabajadores y realizan la reposición de los mismos oportunamente, conforme al desgaste y condiciones de uso.

Realizar la capacitación para el uso de los elementos de protección personal.";"Solicitar los soportes que evidencien la entrega y reposición de los elementos de protección personal a los trabajadores.

Verificar los soportes del cumplimiento del criterio por parte de los contratistas y subcontratistas.

Verificar los soportes que evidencian la realización de la capacitación en el uso de los elementos de protección personal.";;;
68;II. HACER;GESTION DE AMENAZAS (10%);Plan de prevención, preparación y respuesta ante emergencias (10%);21-60 - Plan de prevención, preparación y respuesta ante emergencias;5.1.1;60;;21;60;5.1.1 Se cuenta con el Plan de Prevención,  Preparación y respuesta  ante emergencias;;5;;Plan de prevención, preparación y respuesta ante emergencias;"Elaborar un plan de prevención, preparación y respuesta ante emergencias que identifique las amenazas, evalúe y analice la vulnerabilidad.

Como mínimo el plan debe incluir: planos de las instalaciones que identifican áreas y salidas de emergencia, así como la señalización, realización de simulacros como mínimo una (1) vez al año.

El plan debe tener en cuenta todas las jornadas de trabajo en todos los centros de trabajo y debe ser divulgado
";"Solicitar el plan de prevención, preparación y respuesta ante emergencias y constatar evidencias de su divulgación.

Verificar si existen los planos de las instalaciones que identifican áreas y salidas de emergencia y verificar si existe la debida señalización de la empresa.

Verificar los soportes que evidencien la realización de los simulacros y análisis de los mismos y validar que las recomendaciones emitidas con base en dicho análisis hayan sido tenidas en cuenta en el mejoramiento del plan de emergencias.
";;;
68;II. HACER;GESTION DE AMENAZAS (10%);Plan de prevención, preparación y respuesta ante emergencias (10%);21-60 - Brigada de prevención, preparación y respuesta ante emergencias;5.1.2;60;;21;60;5.1.2 Brigada de prevención conformada, capacitada y dotada;;5;;Brigada de prevención, preparación y respuesta ante emergencias;Conformar, capacitar y dotar la brigada de prevención, preparación y respuesta ante emergencias (primeros auxilios, contra incendios, evacuación, etc.), según las necesidades y el tamaño de la empresa;Solicitar el documento de conformación de la brigada de prevención, preparación y respuesta ante emergencias y verificar los soportes de la capacitación y entrega de la dotación.;;;
68;III. VERIFICAR;VERIFICACIÓN DEL SG-SST (5%);Gestión y resultados del SG-SST (5%);"21-60 - Revisión por la alta dirección. Alcance de la auditoría del Sistema de Gestión
de SST
";6.1.3;60;;21;60;6.1.3 Revisión anual de la alta dirección, resultados de la auditoría;;1.25;;"Revisión por la alta dirección. Alcance de la auditoría del Sistema de Gestión
de SST
";Revisar como mínimo una (1) vez al año, por parte de la alta dirección, el Sistema de Gestión de SST  resultados y  el alcance de la auditoría de cumplimiento del Sistema de Gestión de Seguridad y Salud en el Trabajo, de acuerdo con el los aspectos señalados en el artículo 2.2.4.6.30. del Decreto 1072 de 2015.;Solicitar a la empresa los soportes que den cuenta del alcance de la auditoría, verificando el cumplimiento de los aspectos señalados en los numerales del artículo 2.2.4.6.30. del Decreto 1072 de 2015;;;
